<?xml version="1.0" encoding="utf-8"?>
<!DOCTYPE arkText SYSTEM "arkText.dtd">
<arkText>
  <head>
    <title>Nubibus atris Simplex Sexti toni mutans in secundum tonum</title>
    <wordsAuthor>Boethius (Consolatio philosophiae I:7)</wordsAuthor>
  </head>
  <text>
    <section style="Simple" tone="Tone6" musicMeter="Duple" textMeter="Adonium">
      <lg>
        <l>`Nu-bi-bus `a-tris</l>
        <l>`con-di-ta `nul-lum</l>
        <l>`fun-de-re `pos-sunt</l>
        <l>`si-de-ra `lu-men.</l>
      </lg>
    </section>
    <section style="Simple" tone="Tone2" musicMeter="Duple" textMeter="Adonium">
      <lg>
        <l>`Nu-bi-bus `a-tris</l>
        <l>`con-di-ta `nul-lum</l>
        <l>`fun-de-re `pos-sunt</l>
        <l>`si-de-ra `lu-men.</l>
      </lg>
    </section>
  </text>
</arkText>
