<?xml version="1.0" encoding="utf-8"?>
<!DOCTYPE arkText SYSTEM "arkText.dtd">
<arkText>
  <head>
    <title>Psalmi 150.</title>
    <wordsAuthor>Liber Usualis</wordsAuthor>
  </head>
  <text>
    <section textMeter="Prose" 
        style="{style}" mode="{mode}" musicMeter="{musicMeter}">
      <lg>
        <l>Al-le-`lu-ia.</l>
        <l>Lau-`da-te `Do-mi-num in `sanc-tis `e-jus;</l>
        <l>lau-`da-te `e-um in fir-ma-`men-to vir-`tu-tis `e-ius.</l>
      </lg>
      <lg>
        <l>`Om-nis `spi-ri-tus `lau-det `Do-mi-num! Al-le-`lu-ia.</l>
      </lg>
    </section>
  </text>
</arkText>


