<?xml version="1.0" encoding="utf-8"?>
<!DOCTYPE arkText SYSTEM "arkText.dtd">
<arkText>
  <head>
    <title>Ex hymno Iste confessor Domini sacratus {styleName} {toneName}</title>
    <wordsAuthor>Breviarium Romanum</wordsAuthor>
  </head>
  <text>
    <section textMeter="Sapphicum" style="{style}" tone="{tone}" musicMeter="Duple">
      <lg>
        <l>Sit `sa-lus `il-li, `de-cus, `at-que `vir-tus,</l>
        <l>Qui `su-pra `c√¶-li re-`si-dens ca-`cu-men,</l>
        <l>`To-ti-us `mun-di `ma-chi-nam gu-`ber-nat</l>
        <l>`Tri-nus et `u-nus.</l>
      </lg>
    </section>
  </text>
</arkText>
