<?xml version="1.0" encoding="utf-8"?>
<!DOCTYPE arkText SYSTEM "arkText.dtd">
<arkText>
  <head>
    <title>Ave maris stella {styleName} {toneName}</title>
    <wordsAuthor>Liber Hymnarius</wordsAuthor>
  </head>
  <text>
    <section textMeter="IambicumEuripidaeum" 
      musicMeter="Duple" style="{style}" tone="{tone}">
      <lg>
        <l>`A-ve, `ma-ris `stel-la,</l>
        <l>`De-i `ma-ter `al-ma,</l>
        <l>`at-que `sem-per `vi-rgo,</l>
        <l>`fe-lix `coe-li `por-ta.</l>
      </lg>
    </section>
    </text>
  </arkText>
