<?xml version="1.0" encoding="utf-8"?>
<!DOCTYPE arkText SYSTEM "arkText.dtd">
<arkText>
  <head>
    <title>Iste confessor Domini sacratus</title>
    <wordsAuthor>Breviarium Romanum</wordsAuthor>
  </head>
  <text>
    <section textMeter="Sapphicum" 
      style="{style}" mode="{mode}" musicMeter="{musicMeter}">
      <lg>
        <l>`Is-te Con-`fes-sor `Do-mi-ni sa-`cra-tus,</l>
        <l>`Fes-ta plebs `cu-ius ce-`leb-rat per `or-bem,</l>
        <l>`Ho-di-e `læ-tus `mer-u-it se-`cre-ta</l>
        <l>`Scan-de-re `cæ-li.</l>
      </lg>
      <lg>
        <l>`Un-de nunc `nos-ter `cho-rus in ho-`no-rem</l>
        <l>Ip-`si-us, `hym-num `ca-nit hunc li-`ben-ter,</l>
        <l>Ut `pi-is `e-ius `me-ri-tis iu-`ve-mur</l>
        <l>`Om-ne per `æ-vum.</l>
      </lg>
      <lg>
        <l>Sit `sa-lus `il-li, `de-cus, `at-que `vir-tus,</l>
        <l>Qui `su-pra `cæ-li re-`si-dens ca-`cu-men,</l>
        <l>`To-ti-us `mun-di `ma-chi-nam gu-`ber-nat</l>
        <l>`Tri-nus et `u-nus.</l>
      </lg>
    </section>
    <section textMeter="Prose" 
      style="{style}" mode="{mode}" musicMeter="{musicMeter}">
      <lg>
        <l>`A-men.</l>
      </lg>
    </section>
  </text>
</arkText>
