<?xml version="1.0" encoding="utf-8"?>
<!DOCTYPE arkText SYSTEM "arkText.dtd">
<arkText>
  <head>
    <title>O ter quaterque felix Cicada</title>
    <wordsAuthor>Henricus Stephanus</wordsAuthor>
  </head>
  <text>
    <section textMeter="Anacreonticum"
      musicMeter="Duple" mode="Mode1" style="Florid">
      <lg>
        <l>O ter `qua-ter-que `fe-lix Ci-`ca-da, quae su-`pre-mis</l>
        <l>In ar-`bo-rum vi-re-tis, `ro-ris `pa-rum‿ut bi-`bis-ti,</l>
        <l>Can-`ta-re `dul-ce `gau-des re-`gi-nam `a-gens‿po-`ten-tem.</l>
      </lg>
      <lg>
        <l>Quod-`cun-que con-spi-`cia-ris `tuum est, quod `ar-va `gig-nunt,</l>
        <l>Quod `syl-va `cun-que `pro-fert. Te‿amp-`lec-ti-tur co-`lo-nus,</l>
        <l>Quod `e-jus in la-bo-res in-ju-ri-o-sa non sis:</l>
      </lg>
    </section>
    <section textMeter="Anacreonticum"
      musicMeter="Duple" mode="Mode4" style="Florid">
      <lg>
        <l>`Co-lunt, Ci-`ca-da, `te‿om-nes, di-`vi-na quod `pu-te-ris</l>
        <l>Aes-`ta-tis im-mi-`nen-tis. Te di-`li-gunt Ca-`moe-nae.</l>
        <l>Te di-li-`git-que `Phoe-bus, vo-`cem-que dat ca-`no-ram.</l>
      </lg>
      <lg>
        <l>Te non se-`nec-ta `car-pit. Fes-`ti-va, `ter-rae‿a-`lum-na,</l>
        <l>`Can-tus a-`mi-ca,‿et `om-nis `ma-li‿et do-`lo-ris `ex-pers.</l>
        <l>`Ul-la nec `auc-ta `car-ne, nec `auc-ta `san-gui-`ne‿ul-lo</l>
        <l>`Ip-sis `a-bes `pa-rum‿a diis.</l>
      </lg>
    </section>
  </text>
</arkText>
