<?xml version="1.0" encoding="utf-8"?>
<!DOCTYPE arkText SYSTEM "arkText.dtd">
<arkText>
  <head>
    <title>Fragmentum ex hymno Iste confessor Domini sacratus</title>
    <wordsAuthor>Breviarium Romanum</wordsAuthor>
  </head>
  <text>
    <section textMeter="$textMeter" style="$style" tone="$tone" musicMeter="$meter">
      <lg>
        <l>Sit `sa-lus `il-li, `de-cus, `at-que `vir-tus,</l>
        <l>Qui `su-pra `c√¶-li re-`si-dens ca-`cu-men,</l>
        <l>`To-ti-us `mun-di `ma-chi-nam gu-`ber-nat</l>
        <l>`Tri-nus et `u-nus.</l>
      </lg>
    </section>
  </text>
</arkText>
