<?xml version="1.0" encoding="utf-8"?>
<!DOCTYPE arkText SYSTEM "arkText.dtd">
<arkText>
  <head>
    <title>Ha de los Coros del cielo?</title>
    <wordsAuthor>Ignotus (1650)</wordsAuthor>
  </head>
  <text>
    <section style="Simple" tone="Tone2" musicMeter="TripleMinor" textMeter="Romance">
      <lg>
        <l>Ha de los `Co-ros del `cie-lo?</l>
        <l>`cu-yo mis-te-`rio-so `can-to</l>
        <l>sa-`gra-da can-`ción en-`to-na</l>
        <l>por los `sig-los de los `As-tros.</l>
      </lg>
      <lg>
        <l>Quién in-ter-`rom-`pe lo‿a-`cor-de</l>
        <l>`des-te sa-`gra-do Pa-`la-cio?</l>
        <l>que la ce-`les-te‿ar-mon-`í-a</l>
        <l>pen-`dien-te‿es-`tá de su `la-bio.</l>
      </lg>
      <lg>
        <l>`U-na no-ve-`dad sus-`pen-da</l>
        <l>`vues-tros `Mú-si-cos sa-`gra-dos,</l>
        <l>pues sus-`pen-de‿a las es-`fe-ras</l>
        <l>lo vo-`lub-le de sus `ar-cos.</l>
      </lg>
      <lg>
        <l>`Ha-gan `pau-sa los za`-fi-ros</l>
        <l>`des-te cua-`der-no‿es-tre-`lla-do,</l>
        <l>`de-jen do-bla-da la `ho-ja</l>
        <l>los a-`zu-les car-ta-`pa-cios.</l>
      </lg>
      <lg>
        <l>La con-so-`nan-cia más `nue-va</l>
        <l>es-cu-`chad, que la‿han for-`ma-do,</l>
        <l>`homb-re,‿y Dios en un pe-`se-bre,</l>
        <l>`cie-lo,‿y `tie-rra‿en un es-`tab-lo;</l>
      </lg>
      <lg>
        <l>Des-`puéb-len-se las es-`fe-ras</l>
        <l>de ce-`les-tes ciu-da-`da-nos</l>
        <l>pues `ba-jan a ser sus `glo-rias</l>
        <l>a-leg-`rí-as de los `cam-pos.</l>
      </lg>
    </section>
  </text>
</arkText>

