<?xml version="1.0" encoding="utf-8"?>
<!DOCTYPE arkText SYSTEM "arkText.dtd">
<arkText>
  <head>
    <title>Nubibus atris</title>
    <wordsAuthor>Boethius (Consolatio philosophiae I:7)</wordsAuthor>
  </head>
  <text>
    <section style="Simple" mode="Mode12" musicMeter="TripleMajor" textMeter="Adonium">
      <lg>
        <l>`Nu-bi-bus `a-tris</l>
        <l>`con-di-ta `nul-lum</l>
        <l>`fun-de-re `pos-sunt</l>
        <l>`si-de-ra `lu-men.</l>
      </lg>
    </section>
    <section style="Florid" mode="Mode12" musicMeter="Duple" textMeter="Adonium">
      <lg>
        <l>`Si `ma-re `vo-luens</l>
        <l>`tur-bi-dus `Aus-ter</l>
        <l>`mis-ce-at `aes-tum,</l>
        <l>`vi-tre-a `du-dum</l>
      </lg>
      <lg>
        <l>par que se-`re-nis</l>
        <l>`un-da di-`e-bus</l>
        <l>mox re-so-`lu-to</l>
        <l>`sor-di-da `cae-no</l>
      </lg>
      <lg>
        <l>`vi-si-bus `ob-stat,</l>
        <l>`qui-que va-`ga-tur</l>
        <l>`mon-ti-bus `al-tis</l>
        <l>`de-flu-us `am-nis</l>
      </lg>
      <lg>
        <l>`sae-pe re-`sis-tit</l>
        <l>`ru-pe so-`lu-ti</l>
        <l>`o-bi-ce `sa-xi</l>
        <l>tu `quo-que `si vis</l>
      </lg>
      <lg>
        <l>`lu-mi-ne `cla-ro</l>
        <l>`cer-ne-re `ve-rum,</l>
        <l>`tra-mi-te `rec-to</l>
        <l>`car-pe-re `cal-lem:</l>
      </lg>
    </section>
    <section style="Simple" mode="Mode5" musicMeter="Duple" textMeter="Adonium">
      <lg>
        <l>`gau-di-a `pel-le,</l>
        <l>`pel-le ti-`mo-rem</l>
        <l>`spem-que fu-`ga-to</l>
        <l>nec `do-lor `ad-sit,</l>
        <l>`nu-bi-la `mens est</l>
        <l>`vinc-ta que `fre-nis</l>
        <l>haec `u-bi `reg-nant.</l>
      </lg>
      </section>
  </text>
</arkText>
