<?xml version="1.0" encoding="utf-8"?>
<!DOCTYPE arkText SYSTEM "arkText.dtd">
<arkText>
  <head>
    <title>Iste confessor Domini sacratus (Conclusio)</title>
    <wordsAuthor>Breviarium Romanum</wordsAuthor>
  </head>
  <!-- tones 1, 2, 3, 4, 9, 10 for first three lines -->
  <!-- last line, tones 5, 6, 7, 8, 11, 12 -->
  <text>
    <section textMeter="Sapphicum" style="Florid" tone="Tone1" musicMeter="Duple">
      <lg>
        <l>Sit `sa-lus `il-li, `de-cus, `at-que `vir-tus,</l>
        <l>Qui `su-pra `c√¶-li re-`si-dens ca-`cu-men,</l>
        <l>`To-ti-us `mun-di `ma-chi-nam gu-`ber-nat</l>
      </lg>
    </section>
    <section textMeter="Adonium" style="Florid" tone="Tone6" musicMeter="Duple">
      <lg>
        <l>`Tri-nus et `u-nus.</l>
      </lg>
    </section>
    <section textMeter="Prose" style="Simple" tone="Tone1" musicMeter="Duple">
      <lg>
        <l>A-`men.</l>
      </lg>
    </section>
  </text>
</arkText>
