<?xml version="1.0" encoding="utf-8"?>
<!DOCTYPE arkText SYSTEM "arkText.dtd">
<arkText>
  <head>
    <title>Nubibus atris {styleName} {toneName}</title>
    <wordsAuthor>Boethius (Consolatio philosophiae I:7)</wordsAuthor>
  </head>
  <text>
    <section style="{style}" tone="{tone}" musicMeter="Duple" textMeter="Adonium">
      <lg>
        <l>`Nu-bi-bus `a-tris</l>
        <!--        <l>`con-di-ta `nul-lum</l>
        <l>`fun-de-re `pos-sunt</l>
          <l>`si-de-ra `lu-men.</l>
        -->
      </lg>
    </section>
  </text>
</arkText>
